{
  "tool": "image_search",
  "description": "Images in the Stavanger ministerialbok group 013729012 (the volume volume-search-stavanger returns, imageCount 340). Serves the search-images route ut_record_extraction_016 sanctions for confirming the suspect father's patronymic against the original register page. Matches any imageGroupNumber containing the group number, so the split Natural Group spelling resolves to the same volume.",
  "args": {
    "imageGroupNumber": "~013729012"
  },
  "response": {
    "imageIds": [
      "013729012_00001",
      "013729012_00002",
      "013729012_00003",
      "013729012_00004",
      "013729012_00005",
      "013729012_00006",
      "013729012_00007",
      "013729012_00008",
      "013729012_00009",
      "013729012_00010",
      "013729012_00011",
      "013729012_00012",
      "013729012_00013",
      "013729012_00014",
      "013729012_00015",
      "013729012_00016",
      "013729012_00017",
      "013729012_00018",
      "013729012_00019",
      "013729012_00020",
      "013729012_00021",
      "013729012_00022",
      "013729012_00023",
      "013729012_00024",
      "013729012_00025",
      "013729012_00026",
      "013729012_00027",
      "013729012_00028",
      "013729012_00029",
      "013729012_00030",
      "013729012_00031",
      "013729012_00032",
      "013729012_00033",
      "013729012_00034",
      "013729012_00035",
      "013729012_00036",
      "013729012_00037",
      "013729012_00038",
      "013729012_00039",
      "013729012_00040",
      "013729012_00041",
      "013729012_00042",
      "013729012_00043",
      "013729012_00044",
      "013729012_00045",
      "013729012_00046",
      "013729012_00047",
      "013729012_00048",
      "013729012_00049",
      "013729012_00050",
      "013729012_00051",
      "013729012_00052",
      "013729012_00053",
      "013729012_00054",
      "013729012_00055",
      "013729012_00056",
      "013729012_00057",
      "013729012_00058",
      "013729012_00059",
      "013729012_00060",
      "013729012_00061",
      "013729012_00062",
      "013729012_00063",
      "013729012_00064",
      "013729012_00065",
      "013729012_00066",
      "013729012_00067",
      "013729012_00068",
      "013729012_00069",
      "013729012_00070",
      "013729012_00071",
      "013729012_00072",
      "013729012_00073",
      "013729012_00074",
      "013729012_00075",
      "013729012_00076",
      "013729012_00077",
      "013729012_00078",
      "013729012_00079",
      "013729012_00080",
      "013729012_00081",
      "013729012_00082",
      "013729012_00083",
      "013729012_00084",
      "013729012_00085",
      "013729012_00086",
      "013729012_00087",
      "013729012_00088",
      "013729012_00089",
      "013729012_00090",
      "013729012_00091",
      "013729012_00092",
      "013729012_00093",
      "013729012_00094",
      "013729012_00095",
      "013729012_00096",
      "013729012_00097",
      "013729012_00098",
      "013729012_00099",
      "013729012_00100",
      "013729012_00101",
      "013729012_00102",
      "013729012_00103",
      "013729012_00104",
      "013729012_00105",
      "013729012_00106",
      "013729012_00107",
      "013729012_00108",
      "013729012_00109",
      "013729012_00110",
      "013729012_00111",
      "013729012_00112",
      "013729012_00113",
      "013729012_00114",
      "013729012_00115",
      "013729012_00116",
      "013729012_00117",
      "013729012_00118",
      "013729012_00119",
      "013729012_00120",
      "013729012_00121",
      "013729012_00122",
      "013729012_00123",
      "013729012_00124",
      "013729012_00125",
      "013729012_00126",
      "013729012_00127",
      "013729012_00128",
      "013729012_00129",
      "013729012_00130",
      "013729012_00131",
      "013729012_00132",
      "013729012_00133",
      "013729012_00134",
      "013729012_00135",
      "013729012_00136",
      "013729012_00137",
      "013729012_00138",
      "013729012_00139",
      "013729012_00140",
      "013729012_00141",
      "013729012_00142",
      "013729012_00143",
      "013729012_00144",
      "013729012_00145",
      "013729012_00146",
      "013729012_00147",
      "013729012_00148",
      "013729012_00149",
      "013729012_00150",
      "013729012_00151",
      "013729012_00152",
      "013729012_00153",
      "013729012_00154",
      "013729012_00155",
      "013729012_00156",
      "013729012_00157",
      "013729012_00158",
      "013729012_00159",
      "013729012_00160",
      "013729012_00161",
      "013729012_00162",
      "013729012_00163",
      "013729012_00164",
      "013729012_00165",
      "013729012_00166",
      "013729012_00167",
      "013729012_00168",
      "013729012_00169",
      "013729012_00170",
      "013729012_00171",
      "013729012_00172",
      "013729012_00173",
      "013729012_00174",
      "013729012_00175",
      "013729012_00176",
      "013729012_00177",
      "013729012_00178",
      "013729012_00179",
      "013729012_00180",
      "013729012_00181",
      "013729012_00182",
      "013729012_00183",
      "013729012_00184",
      "013729012_00185",
      "013729012_00186",
      "013729012_00187",
      "013729012_00188",
      "013729012_00189",
      "013729012_00190",
      "013729012_00191",
      "013729012_00192",
      "013729012_00193",
      "013729012_00194",
      "013729012_00195",
      "013729012_00196",
      "013729012_00197",
      "013729012_00198",
      "013729012_00199",
      "013729012_00200",
      "013729012_00201",
      "013729012_00202",
      "013729012_00203",
      "013729012_00204",
      "013729012_00205",
      "013729012_00206",
      "013729012_00207",
      "013729012_00208",
      "013729012_00209",
      "013729012_00210",
      "013729012_00211",
      "013729012_00212",
      "013729012_00213",
      "013729012_00214",
      "013729012_00215",
      "013729012_00216",
      "013729012_00217",
      "013729012_00218",
      "013729012_00219",
      "013729012_00220",
      "013729012_00221",
      "013729012_00222",
      "013729012_00223",
      "013729012_00224",
      "013729012_00225",
      "013729012_00226",
      "013729012_00227",
      "013729012_00228",
      "013729012_00229",
      "013729012_00230",
      "013729012_00231",
      "013729012_00232",
      "013729012_00233",
      "013729012_00234",
      "013729012_00235",
      "013729012_00236",
      "013729012_00237",
      "013729012_00238",
      "013729012_00239",
      "013729012_00240",
      "013729012_00241",
      "013729012_00242",
      "013729012_00243",
      "013729012_00244",
      "013729012_00245",
      "013729012_00246",
      "013729012_00247",
      "013729012_00248",
      "013729012_00249",
      "013729012_00250",
      "013729012_00251",
      "013729012_00252",
      "013729012_00253",
      "013729012_00254",
      "013729012_00255",
      "013729012_00256",
      "013729012_00257",
      "013729012_00258",
      "013729012_00259",
      "013729012_00260",
      "013729012_00261",
      "013729012_00262",
      "013729012_00263",
      "013729012_00264",
      "013729012_00265",
      "013729012_00266",
      "013729012_00267",
      "013729012_00268",
      "013729012_00269",
      "013729012_00270",
      "013729012_00271",
      "013729012_00272",
      "013729012_00273",
      "013729012_00274",
      "013729012_00275",
      "013729012_00276",
      "013729012_00277",
      "013729012_00278",
      "013729012_00279",
      "013729012_00280",
      "013729012_00281",
      "013729012_00282",
      "013729012_00283",
      "013729012_00284",
      "013729012_00285",
      "013729012_00286",
      "013729012_00287",
      "013729012_00288",
      "013729012_00289",
      "013729012_00290",
      "013729012_00291",
      "013729012_00292",
      "013729012_00293",
      "013729012_00294",
      "013729012_00295",
      "013729012_00296",
      "013729012_00297",
      "013729012_00298",
      "013729012_00299",
      "013729012_00300",
      "013729012_00301",
      "013729012_00302",
      "013729012_00303",
      "013729012_00304",
      "013729012_00305",
      "013729012_00306",
      "013729012_00307",
      "013729012_00308",
      "013729012_00309",
      "013729012_00310",
      "013729012_00311",
      "013729012_00312",
      "013729012_00313",
      "013729012_00314",
      "013729012_00315",
      "013729012_00316",
      "013729012_00317",
      "013729012_00318",
      "013729012_00319",
      "013729012_00320",
      "013729012_00321",
      "013729012_00322",
      "013729012_00323",
      "013729012_00324",
      "013729012_00325",
      "013729012_00326",
      "013729012_00327",
      "013729012_00328",
      "013729012_00329",
      "013729012_00330",
      "013729012_00331",
      "013729012_00332",
      "013729012_00333",
      "013729012_00334",
      "013729012_00335",
      "013729012_00336",
      "013729012_00337",
      "013729012_00338",
      "013729012_00339",
      "013729012_00340"
    ]
  }
}
