{
  "tool": "person_quality",
  "description": "person_quality on BRNN-CH1 -- a clean profile: overall 1.0, no issues. init-project imports this person with a local id and their FamilySearch link in ark; check-warnings' person_quality call resolves the local id to BRNN-CH1 through that link. Used by the living-cumulative init-project test.",
  "args": {
    "personId": "BRNN-CH1"
  },
  "response": {
    "personId": "BRNN-CH1",
    "segment": null,
    "overallScore": 1,
    "issueCount": 0,
    "categories": [
      {
        "scoreType": "COMPLETENESS",
        "count": 0,
        "score": 1
      },
      {
        "scoreType": "VERIFIABILITY",
        "count": 0,
        "score": 1
      },
      {
        "scoreType": "CONSISTENCY",
        "count": 0,
        "score": 1
      },
      {
        "scoreType": "COHERENCE",
        "count": 0,
        "score": 1
      }
    ],
    "issues": []
  }
}
