{
  "tool": "person_warnings",
  "description": "person_warnings on Patrick (I1) returns hasEventAfterDeath1 with factIds pointing at F3 -- a Military fact dated 1909-11-04, about 20 months after Patrick's 1908-03-12 death. In the flynn-widow-pension scenario F3 cites S6, the widow's pension application filed by Bridget Flynn that names Patrick as her late husband and was auto-attached to Patrick as a Military fact dated to its filing. Both dates are correct: the death creates the entitlement, so the filing postdating it is the expected sequence. The correct reading is a posthumous mention of the survivor's-claim kind -- keep the source and correct the fact it was recorded as, NOT unlink it, and NOT identity confusion or a wrong death date. Used by ut_check_warnings_v4m.",
  "args": {
    "personId": "I1"
  },
  "response": {
    "warningCount": 1,
    "warnings": [
      {
        "scoreType": "COHERENCE",
        "issueType": "hasEventAfterDeath1",
        "severity": "contradiction",
        "personId": "I1",
        "personName": "Patrick Flynn",
        "factIds": [
          "F1",
          "F2",
          "F3"
        ],
        "message": "An event is dated more than 1 year after this person's latest death-like fact."
      }
    ]
  }
}
