{
  "tool": "record_attachments",
  "description": "Attachment check for full-text search results mentioning Flynn family as witnesses. All results come back unattached — typical for FAN (Family/Associates/Neighbors) evidence which is rarely pre-attached to tree persons.",
  "args": {
    "uris": "~"
  },
  "input_schema": {
    "type": "object",
    "properties": {
      "uris": {
        "type": "array",
        "items": { "type": "string" },
        "description": "List of historical record persona ARK URLs to check. These come from the arkUrl or id field of search results."
      }
    },
    "required": ["uris"]
  },
  "response": {
    "attachments": {},
    "unattached": [
      "https://www.familysearch.org/ark:/61903/1:1:FT-WTNS-001",
      "https://www.familysearch.org/ark:/61903/1:1:FT-WTNS-002",
      "https://www.familysearch.org/ark:/61903/1:1:FT-WTNS-003"
    ]
  }
}
