{
  "tool": "person_warnings",
  "description": "person_warnings on Patrick (I1) returns hasAgeRangeGreaterThan120 -- gap between earliest possible birth year and latest possible death year exceeds 120. Used by ut_check_warnings_006 (severity classification dimension).",
  "args": {
    "personId": "I1"
  },
  "response": {
    "warningCount": 1,
    "warnings": [
      {
        "scoreType": "COHERENCE",
        "issueType": "hasAgeRangeGreaterThan120",
        "severity": "contradiction",
        "personId": "I1",
        "personName": "Patrick Flynn",
        "message": "This person's lifespan is greater than 120 years, which is implausible.",
        "facts": [
          {
            "id": "F1",
            "type": "Birth",
            "date": "~1785"
          },
          {
            "id": "F2",
            "type": "Death",
            "date": "1908-03-12"
          }
        ]
      }
    ]
  }
}
