{
  "tool": "record_read",
  "description": "FamilySearch record_read response for record M9PL-7RT: the 1900 census household of George Bennett, Springfield, Illinois, with its relationship-to-head column. Shaped like a live read (a Record and a Collection source description, per-persona indexFields).",
  "args": {
    "recordId": "~M9PL-7RT"
  },
  "response": {
    "persons": [
      {
        "id": "p_1",
        "gender": "Male",
        "names": [
          {
            "id": "n_1",
            "type": "BirthName",
            "given": "George",
            "surname": "Bennett"
          }
        ],
        "principal": true,
        "facts": [
          {
            "type": "Race",
            "value": "White"
          },
          {
            "type": "Occupation",
            "value": "Farmer"
          },
          {
            "type": "Census",
            "date": "1900",
            "place": "Springfield, Sangamon, Illinois, United States"
          },
          {
            "type": "Birth",
            "date": "1855",
            "place": "Ohio"
          }
        ],
        "sources": [
          {
            "ref": "src_r_1"
          }
        ]
      },
      {
        "id": "p_2",
        "gender": "Female",
        "names": [
          {
            "id": "n_2",
            "type": "BirthName",
            "given": "Sarah",
            "surname": "Bennett"
          }
        ],
        "principal": true,
        "facts": [
          {
            "type": "Race",
            "value": "White"
          },
          {
            "type": "Census",
            "date": "1900",
            "place": "Springfield, Sangamon, Illinois, United States"
          },
          {
            "type": "Birth",
            "date": "1858",
            "place": "Ohio"
          }
        ],
        "sources": [
          {
            "ref": "src_r_1"
          }
        ]
      },
      {
        "id": "p_3",
        "gender": "Male",
        "names": [
          {
            "id": "n_3",
            "type": "BirthName",
            "given": "Charles",
            "surname": "Bennett"
          }
        ],
        "principal": true,
        "facts": [
          {
            "type": "Race",
            "value": "White"
          },
          {
            "type": "Occupation",
            "value": "Farm Laborer"
          },
          {
            "type": "Census",
            "date": "1900",
            "place": "Springfield, Sangamon, Illinois, United States"
          },
          {
            "type": "Birth",
            "date": "1884",
            "place": "Illinois"
          }
        ],
        "sources": [
          {
            "ref": "src_r_1"
          }
        ]
      },
      {
        "id": "p_4",
        "gender": "Female",
        "names": [
          {
            "id": "n_4",
            "type": "BirthName",
            "given": "Emma",
            "surname": "Bennett"
          }
        ],
        "principal": true,
        "facts": [
          {
            "type": "Race",
            "value": "White"
          },
          {
            "type": "Occupation",
            "value": "At School"
          },
          {
            "type": "Census",
            "date": "1900",
            "place": "Springfield, Sangamon, Illinois, United States"
          },
          {
            "type": "Birth",
            "date": "1888",
            "place": "Illinois"
          }
        ],
        "sources": [
          {
            "ref": "src_r_1"
          }
        ]
      }
    ],
    "relationships": [
      {
        "id": "r_1",
        "type": "Couple",
        "person1": "p_1",
        "person2": "p_2"
      },
      {
        "id": "r_2",
        "type": "ParentChild",
        "parent": "p_1",
        "child": "p_3"
      },
      {
        "id": "r_3",
        "type": "ParentChild",
        "parent": "p_2",
        "child": "p_3"
      },
      {
        "id": "r_4",
        "type": "ParentChild",
        "parent": "p_1",
        "child": "p_4"
      },
      {
        "id": "r_5",
        "type": "ParentChild",
        "parent": "p_2",
        "child": "p_4"
      }
    ],
    "sources": [
      {
        "id": "src_r_1",
        "resource_type": "Record",
        "title": "Entry for George Bennett and Sarah Bennett, \"United States, Census, 1900\"",
        "citation": "\"United States, Census, 1900\", <i>FamilySearch</i> (https://www.familysearch.org/ark:/61903/1:1:M9PL-7RT : accessed 30 September 2026), Entry for George Bennett and Sarah Bennett.",
        "url": "https://www.familysearch.org/ark:/61903/1:1:M9PL-7RT"
      },
      {
        "id": "sd_c_1",
        "resource_type": "Collection",
        "title": "United States, Census, 1900"
      }
    ],
    "places": [],
    "indexFields": {
      "p_1": {
        "sortKey": "0000000000000001_00001_00001_0000000000000001_000",
        "age": "45",
        "relationshipToHead": "Head",
        "householdId": "1"
      },
      "p_2": {
        "sortKey": "0000000000000001_00001_00001_0000000000000001_001",
        "age": "42",
        "relationshipToHead": "Wife",
        "householdId": "1"
      },
      "p_3": {
        "sortKey": "0000000000000001_00001_00001_0000000000000001_002",
        "age": "16",
        "relationshipToHead": "Son",
        "householdId": "1"
      },
      "p_4": {
        "sortKey": "0000000000000001_00001_00001_0000000000000001_003",
        "age": "12",
        "relationshipToHead": "Daughter",
        "householdId": "1"
      }
    }
  }
}
